{
  "schema_version": "1.0.0",
  "dataset_id": "transcriptforge-public-microarray-demo",
  "organism": "Homo sapiens",
  "source_kind": "affymetrix_cel",
  "platform": {
    "platform_id": "affymetrix_hugene_1_0_st_v1",
    "definition_sha256": "5f1df1e1613301cda4b12df7c9b74ad6eee33671663b0393e9e643d1d05d3563",
    "adapter_version": "1.0.0",
    "vendor": "Affymetrix",
    "array_design": "Human Gene 1.0 ST Array",
    "detected_chip_type": "HuGene-1_0-st-v1",
    "cel_format": "calvin",
    "normalization": {
      "engine": "oligo",
      "method": "rma",
      "target": "probeset",
      "pd_info_package": "pd.hugene.1.0.st.v1"
    },
    "annotation": {
      "package": "hugene10sttranscriptcluster.db",
      "probe_key": "PROBEID",
      "gene_id_field": "ENSEMBL",
      "gene_symbol_field": "SYMBOL",
      "confidence": "explicit_platform_adapter"
    }
  },
  "aggregation_method": "highest_mad",
  "sample_metadata": {
    "dataset_file_id": "public-demo-metadata",
    "role": "sample_metadata",
    "original_name": "sample_metadata.tsv",
    "storage_uri": "demo://microarray/sample_metadata.tsv",
    "size_bytes": 618,
    "sha256": "15a7675977d4f371c51a23373b05e3c07dbc267d99ab2345f800faddceab996b"
  },
  "sample_count": 8,
  "cel_file_count": 8,
  "samples": [
    {
      "sample_id": "GSM979412",
      "cel_file": {"dataset_file_id": "public-demo-gsm979412", "role": "cel_file", "original_name": "GSM979412_71D.CEL.gz", "storage_uri": "https://ftp.ncbi.nlm.nih.gov/geo/samples/GSM979nnn/GSM979412/suppl/GSM979412_71D.CEL.gz", "size_bytes": 3974718, "sha256": "50dcc4031fcfd062899e28f7f9b5138b0f6b290dcca37ebd6493d0561cc3d176"},
      "metadata": {"geo_accession": "GSM979412", "donor": "71", "age": "44", "sex": "male", "zone": "deep", "study": "GSE39795"}
    },
    {
      "sample_id": "GSM979414",
      "cel_file": {"dataset_file_id": "public-demo-gsm979414", "role": "cel_file", "original_name": "GSM979414_71S.CEL.gz", "storage_uri": "https://ftp.ncbi.nlm.nih.gov/geo/samples/GSM979nnn/GSM979414/suppl/GSM979414_71S.CEL.gz", "size_bytes": 3773822, "sha256": "5ae7681a7007988d8b6d09fcb03b0b7e5d93691ce6244a4c25ab43a44d934428"},
      "metadata": {"geo_accession": "GSM979414", "donor": "71", "age": "44", "sex": "male", "zone": "superficial", "study": "GSE39795"}
    },
    {
      "sample_id": "GSM979415",
      "cel_file": {"dataset_file_id": "public-demo-gsm979415", "role": "cel_file", "original_name": "GSM979415_77D.CEL.gz", "storage_uri": "https://ftp.ncbi.nlm.nih.gov/geo/samples/GSM979nnn/GSM979415/suppl/GSM979415_77D.CEL.gz", "size_bytes": 3849221, "sha256": "f13905cbe198e21f95feeceafa49afa133fa7ee101f0fd69da96730c963fc40d"},
      "metadata": {"geo_accession": "GSM979415", "donor": "77", "age": "46", "sex": "male", "zone": "deep", "study": "GSE39795"}
    },
    {
      "sample_id": "GSM979417",
      "cel_file": {"dataset_file_id": "public-demo-gsm979417", "role": "cel_file", "original_name": "GSM979417_77S.CEL.gz", "storage_uri": "https://ftp.ncbi.nlm.nih.gov/geo/samples/GSM979nnn/GSM979417/suppl/GSM979417_77S.CEL.gz", "size_bytes": 3976525, "sha256": "9ae43fd061776e7f19cf608851511a3da3cf89fa9519134d6f89584722dbc996"},
      "metadata": {"geo_accession": "GSM979417", "donor": "77", "age": "46", "sex": "male", "zone": "superficial", "study": "GSE39795"}
    },
    {
      "sample_id": "GSM979418",
      "cel_file": {"dataset_file_id": "public-demo-gsm979418", "role": "cel_file", "original_name": "GSM979418_91D.CEL.gz", "storage_uri": "https://ftp.ncbi.nlm.nih.gov/geo/samples/GSM979nnn/GSM979418/suppl/GSM979418_91D.CEL.gz", "size_bytes": 3846113, "sha256": "a172b9d985c82f2e92021668e3c13c64eea04bbf72ebec9318fdbd1cebd59eb3"},
      "metadata": {"geo_accession": "GSM979418", "donor": "91", "age": "23", "sex": "female", "zone": "deep", "study": "GSE39795"}
    },
    {
      "sample_id": "GSM979420",
      "cel_file": {"dataset_file_id": "public-demo-gsm979420", "role": "cel_file", "original_name": "GSM979420_91S.CEL.gz", "storage_uri": "https://ftp.ncbi.nlm.nih.gov/geo/samples/GSM979nnn/GSM979420/suppl/GSM979420_91S.CEL.gz", "size_bytes": 4086781, "sha256": "8d4d93d2d3a7a4df1d53955011025dc65c52b205f743667acc536a7c4082433c"},
      "metadata": {"geo_accession": "GSM979420", "donor": "91", "age": "23", "sex": "female", "zone": "superficial", "study": "GSE39795"}
    },
    {
      "sample_id": "GSM979421",
      "cel_file": {"dataset_file_id": "public-demo-gsm979421", "role": "cel_file", "original_name": "GSM979421_93D.CEL.gz", "storage_uri": "https://ftp.ncbi.nlm.nih.gov/geo/samples/GSM979nnn/GSM979421/suppl/GSM979421_93D.CEL.gz", "size_bytes": 4027790, "sha256": "b4d11088cbbb96feaf40ca2ff83082fcce3186ca0c95ab44d71d5a17e246276a"},
      "metadata": {"geo_accession": "GSM979421", "donor": "93", "age": "24", "sex": "male", "zone": "deep", "study": "GSE39795"}
    },
    {
      "sample_id": "GSM979423",
      "cel_file": {"dataset_file_id": "public-demo-gsm979423", "role": "cel_file", "original_name": "GSM979423_93S.CEL.gz", "storage_uri": "https://ftp.ncbi.nlm.nih.gov/geo/samples/GSM979nnn/GSM979423/suppl/GSM979423_93S.CEL.gz", "size_bytes": 3776433, "sha256": "1758f03ded2a161c8731f8b65d247c97f5cee4d4006854cc31fba478fd14a7b5"},
      "metadata": {"geo_accession": "GSM979423", "donor": "93", "age": "24", "sex": "male", "zone": "superficial", "study": "GSE39795"}
    }
  ],
  "warnings": [
    "This paired public fixture validates execution and statistical plumbing; biological findings remain exploratory and require independent validation."
  ]
}
